{
  "schema_version": "s2_13_s3_7_transition_readiness@10.0.0",
  "report_id": "s2_13_s3_7_transition_readiness_v10",
  "supersedes": [
    {
      "path": "configs/schemas/s2_13_s3_7_transition_readiness_v9.schema.json",
      "sha256": "e5eca18d75839e0daf1fd96f8b84bb170b13180b9b0780379266e08e6ac3cda2",
      "byte_size": 1359,
      "reason": "v10 supersedes v9 by replacing its three-method/API-arm S2.12 state with the current verified two-method contract; v9 assets stay byte-exact"
    },
    {
      "path": "scripts/build_s2_13_s3_7_transition_readiness_v9.py",
      "sha256": "36e2f26b214bed2bd89f1df9e697b0fb422ceefde132284d5f5582f5b123b6b0",
      "byte_size": 19936,
      "reason": "v10 supersedes v9 by replacing its three-method/API-arm S2.12 state with the current verified two-method contract; v9 assets stay byte-exact"
    },
    {
      "path": "scripts/verify_s2_13_s3_7_transition_readiness_v9.py",
      "sha256": "57c5f4529d700fff6f751a057deaf828f8353aefad3ad13ff5fb62091c2218cc",
      "byte_size": 8678,
      "reason": "v10 supersedes v9 by replacing its three-method/API-arm S2.12 state with the current verified two-method contract; v9 assets stay byte-exact"
    },
    {
      "path": "tests/test_s2_13_s3_7_transition_readiness_v9.py",
      "sha256": "8523369ba0cfd476e512c3106c649ce076720e7640d2c39930af972923863255",
      "byte_size": 4049,
      "reason": "v10 supersedes v9 by replacing its three-method/API-arm S2.12 state with the current verified two-method contract; v9 assets stay byte-exact"
    },
    {
      "path": "outputs/reports/s2_13_s3_7_transition_readiness_v9.json",
      "sha256": "1a767e64db7bbbb6f9b594d433d0c91581e0d35cf9b558b5997ec60cb5f305a4",
      "byte_size": 25000,
      "reason": "v10 supersedes v9 by replacing its three-method/API-arm S2.12 state with the current verified two-method contract; v9 assets stay byte-exact"
    },
    {
      "path": "outputs/reports/s2_13_s3_7_transition_readiness_v9.md",
      "sha256": "f36a66f69e310281bfc55a5c29cfb9a975ae0677cbf3f031b8ff917208f0abbe",
      "byte_size": 1192,
      "reason": "v10 supersedes v9 by replacing its three-method/API-arm S2.12 state with the current verified two-method contract; v9 assets stay byte-exact"
    },
    {
      "path": "outputs/reports/s2_13_s3_7_transition_readiness_v9.manifest.json",
      "sha256": "f2bddded0bf84238671ea4c3312695908e9671790956a6e4623ca97192ff7a59",
      "byte_size": 5200,
      "reason": "v10 supersedes v9 by replacing its three-method/API-arm S2.12 state with the current verified two-method contract; v9 assets stay byte-exact"
    },
    {
      "path": "outputs/reports/s2_13_s3_7_transition_readiness_v9_export_index.json",
      "sha256": "019f5f3d57c75a9270be58b1f1d125a1371b61620c61c17d68167fb29ff2e8b8",
      "byte_size": 642,
      "reason": "v10 supersedes v9 by replacing its three-method/API-arm S2.12 state with the current verified two-method contract; v9 assets stay byte-exact"
    }
  ],
  "pipeline_state": {
    "S1.7": "frozen",
    "S2.11": "verified_frozen",
    "S2.12": "partial_two_method_contract_pending_direct_llm",
    "S2.13": "blocked_only_on_two_method_contract",
    "S3.4_S3.6": "development_only",
    "S3.7": "gold_rule_records_published_oracle_isolation_run_formal_main_table_not_authorized"
  },
  "s2_11": {
    "status": "verified_frozen",
    "adjudicated": 36,
    "unresolved": 0,
    "reviewer": "hyc",
    "formal_gold": {
      "path": "data/gold/stage2/s2_11_complex_corpus_formal_gold_v1.json",
      "sha256": "039ae8b2429826ae2b320667fb4a0dff96de6408b0a9637c1d9911565129c804",
      "byte_size": 83915
    },
    "formal_gold_payload_sha256": "039ae8b2429826ae2b320667fb4a0dff96de6408b0a9637c1d9911565129c804",
    "confirmation_event": {
      "path": "configs/s2_11_batch_import_confirmation_event_v3.json",
      "sha256": "226b47982934dafce987b34df857144a046c7cbf54b5969efa4fb19e2d079405",
      "byte_size": 871
    },
    "provenance": "deepseek_offline_proposal_v3 + user batch confirmation by hyc; not independent-from-scratch expert annotation"
  },
  "s2_12": {
    "status": "partial",
    "active_methods": [
      "sun_rule_only",
      "direct_llm"
    ],
    "cancelled_methods": [
      "sun_llm_fallback"
    ],
    "two_method_contract": {
      "path": "outputs/reports/s2_12_two_method_contract_v1.json",
      "sha256": "61d23a39c2fa2d27bd33af28acd0f26328fcb6b904a2fecc6dd960b289f3096f",
      "byte_size": 11699
    },
    "two_method_contract_manifest": {
      "path": "outputs/reports/s2_12_two_method_contract_v1.manifest.json",
      "sha256": "13526bdcf85110ec2b5948907b6e6357489707e34afb9357ecd26b1c0a399c44",
      "byte_size": 2637
    },
    "comparison_complete": false,
    "completion_evidence": {
      "sun_rule_only": {
        "verified": true,
        "input_binding_ok": true,
        "all_36_rows": true,
        "metrics_valid": true
      },
      "direct_llm": {
        "verified": false,
        "input_binding_ok": false,
        "all_36_rows": false,
        "metrics_valid": false
      }
    },
    "cancelled_repair_arm": {
      "status": "cancelled_not_an_experimental_condition",
      "calls_removed": 27,
      "required_for_completion": false
    },
    "remaining_calls": {
      "s2_12_direct": 36,
      "gdpr7_direct": 74,
      "total": 110
    },
    "post_result_tuning_performed": false,
    "readiness_v4": {
      "path": "outputs/reports/s2_12_execution_readiness_v4.json",
      "sha256": "ce249166173b7cfbf42932e9ac76f7b45266ff2b11f917f777425b9f5e77b73f",
      "byte_size": 14613
    },
    "gold_blind_input": {
      "path": "data/input/s2_12_complex_corpus_formal_input_v1.json",
      "sha256": "892d4284ea70c38f82a47f821c13622f1b07744253429e466038ddb5db96660e",
      "byte_size": 17784
    },
    "sun_rule_only": {
      "status": "verified_complete",
      "evaluation": {
        "path": "data/results/s2_12_sun_rule_only_v1/evaluation.json",
        "sha256": "1696dbf9dcf85ef30f6056fc109c9952f0465ac21ac080314e57f7fa33799e16",
        "byte_size": 11532
      },
      "actual_cost_usd": 0.0
    },
    "direct_llm": {
      "status": "pending_evidence",
      "evaluation": null,
      "remaining_calls": 36
    },
    "offline_batch_readiness": {
      "historical_report": {
        "path": "outputs/reports/s2_llm_batches_offline_readiness_v1.json",
        "sha256": "c5cfa4613e6fbf6061fe28c8bb79b44dadcf86a915544fd6803a4c33de788de3",
        "byte_size": 10496
      },
      "historical_real_calls_remaining": 137,
      "historical_scope_superseded": true,
      "current_remaining_calls": {
        "s2_12_direct": 36,
        "gdpr7_direct": 74,
        "total": 110
      },
      "current_remaining_total": 110,
      "note": "the historical offline-readiness report described the superseded 137-call three-arm scope; the current two-method contract owns the remaining-call count"
    },
    "three_method_comparison_complete": false,
    "historical_three_method_capsules_retained": true
  },
  "s2_13": {
    "status": "blocked_only_on_two_method_contract",
    "blockers": [
      "direct_llm_evaluation_missing_or_not_complete"
    ],
    "note": "S2.13 is blocked only on the current two-method S2.12 evidence chain. The cancelled Rules+LLM-Repair arm is not a dependency."
  },
  "stage3": {
    "S3.4": "development_only",
    "S3.5": "development_only",
    "S3.6": "development_only",
    "S3.7": {
      "status": "gold_rule_records_published_and_oracle_isolation_run; formal main table NOT started or authorized",
      "authorized": false,
      "gold_rule_records_present": true,
      "oracle_isolation_started": true,
      "blockers": [
        "S2.13 freeze checkpoint",
        "formal promotion of S3.4-S3.6",
        "user authorization for the formal Oracle main table"
      ]
    }
  },
  "gold_rule_records": {
    "exist": true,
    "verifier_verified": true,
    "verifier_checks": 32,
    "counts": {
      "rules": 9,
      "sentences": 74,
      "items": 92,
      "spans": 235,
      "modality_evidence_spans": 85,
      "relation_entries": 38
    },
    "modality_item_counts": {
      "obligation": 30,
      "permission": 36,
      "prohibition": 4,
      "definition": 22
    },
    "covered_rule_ids": [
      "article15",
      "article16",
      "article17",
      "article20",
      "article22",
      "article33",
      "article34",
      "article6",
      "article7"
    ],
    "bindings": {
      "gold": {
        "path": "data/gold/stage3/gdpr7_gold_rule_records_v1.json",
        "sha256": "7cf896abdb6e420e46efd297a8e183bcdc4c15834aa9567eb88d1af60eec627a",
        "byte_size": 188786
      },
      "manifest": {
        "path": "outputs/reports/gdpr7_gold_rule_records_v1.manifest.json",
        "sha256": "a9e8c51d05e50c201f747d5248c022d521c557e5b31f9ba4920207931d912efd",
        "byte_size": 6713
      },
      "verifier": {
        "path": "scripts/verify_gdpr7_gold_rule_records_v1.py",
        "sha256": "d3119c6a324ecef1a6a17b76ae24b429f978db2aaa752acedf84aee6ec19b0e0",
        "byte_size": 23025
      },
      "capsule": {
        "path": "data/predictions/gdpr7_human_rule_record_v1/predictions.json",
        "sha256": "9d86e1b4360a8ef2d9acfacdda4cd3b5d7e2e35f7f3de68eeebaa0a793432500",
        "byte_size": 140624
      },
      "confirmed_human_bundle": {
        "path": "data/development/human_review/gdpr7_human_confirmed_v1/confirmed_rule_items.json",
        "sha256": "930357a9539a3e1b11fab9943eb3ca1978ca3596605f1264aea821960a47fc78",
        "byte_size": 227804
      },
      "authorization_event": {
        "path": "configs/gdpr7_gold_rule_records_authorization_event_v1.json",
        "sha256": "aa2a09961debefd3baaf2327bb3ed78c5d066aa887ea2dbba3b532b6253f8b68",
        "byte_size": 2028
      },
      "schema": {
        "path": "configs/schemas/gdpr7_gold_rule_record_v1.schema.json",
        "sha256": "f3f6ea0ceff4acd6d48b6a108b7dd70b53783131d184f570497f1a9ba0f1b185",